Sociétés_de_production,acteurs,budget,date,desciption,durée,genre,langue_d_origine,nbr_votants,pays,score,titre_original
Miramax,"John Travolta,Uma Thurman,Samuel L. Jackson","$8,000,000 (estimated)",1994,"The lives of two mob hitmen, a boxer, a gangster and his wife, and a pair of diner bandits intertwine in four tales of violence and redemption.",154,"Crime,Drama",English,2.1M,United States,8.9,Pulp Fiction
Philippa Boyens,"J.R.R. Tolkien,Fran Walsh,Philippa Boyens","$94,000,000 (estimated)",2003,Gandalf and Aragorn lead the World of Men against Sauron's army to draw his gaze from Frodo and Sam as they approach Mount Doom with the One Ring.,201,"Action,Adventure,Drama",Official site: The Lord of the Rings Trilogy,1.9M,New Zealand,9.0,The Lord of the Rings: The Return of the King
Universal Pictures,"Liam Neeson,Ralph Fiennes,Ben Kingsley","$22,000,000 (estimated)",1993,"In German-occupied Poland during World War II, industrialist Oskar Schindler gradually becomes concerned for his Jewish workforce after witnessing their persecution by the Nazis.",195,"Biography,Drama,History",English,1.4M,United States,9.0,Schindler's List
Orion-Nova Productions,"Henry Fonda,Lee J. Cobb,Martin Balsam","$350,000 (estimated)",1957,The jury in a New York City murder trial is frustrated by a single member whose skeptical caution forces them to more carefully consider the evidence before jumping to a hasty verdict.,96,"Crime,Drama",,807K,United States,9.0,12 Angry Men
Official Twitter,"Al Pacino,Robert De Niro,Robert Duvall","$13,000,000 (estimated)",1974,"The early life and career of Vito Corleone in 1920s New York City is portrayed, while his son, Michael, expands and tightens his grip on the family crime syndicate.",202,"Crime,Drama",Spanish,1.3M,United States,9.0,The Godfather Part II
David S. Goyer,"Jonathan Nolan,Christopher Nolan,David S. Goyer","$185,000,000 (estimated)",2008,"When the menace known as the Joker wreaks havoc and chaos on the people of Gotham, Batman must accept one of the greatest psychological and physical tests of his ability to fight injustice.",152,"Action,Crime,Drama",Warner Bros.,2.7M,United States,9.0,The Dark Knight
Official Instagram,"Marlon Brando,Al Pacino,James Caan","$6,000,000 (estimated)",1972,The aging patriarch of an organized crime dynasty in postwar New York City transfers control of his clandestine empire to his reluctant youngest son.,175,"Crime,Drama",Latin,1.9M,United States,9.2,The Godfather
